{
  "$schema": "./sfdx-project.schema.json",
  "packageDirectories": [
    {
      "path": "force-app",
      "default": true
    }
  ],
  "namespace": "",
  "sfdcLoginUrl": "https://login.salesforce.com",
  "sourceApiVersion": "43.0",
  "packageAliases": {
    "dreamhouse": "0Ho1I000000XZDVSA4",
    "dreamhouse@2.0.0-4": "04t1I0000036seVQAQ"
  }
}
